{
  "schema_version": "quiver.improvement.v1",
  "id": "QI-0004",
  "title": "Use Codex-compatible strict JSON schemas",
  "category": "schema",
  "status": "implemented",
  "severity": "high",
  "confidence": "high",
  "problem": "The first real Codex run rejected the output schema because structured output requires explicit types and stricter object shapes.",
  "proposed_change": "Keep the runtime GraphDelta schema compatible with Codex --output-schema, including typed const fields, required properties, and closed evidence objects.",
  "acceptance_criteria": "A real Codex extraction accepts the schema and writes a validated delta.",
  "observations": [],
  "created_at": "2026-06-22T12:19:47.108003Z",
  "updated_at": "2026-06-22T12:19:47.186626Z",
  "history": [
    {
      "at": "2026-06-22T12:19:47.186663Z",
      "from": "proposed",
      "to": "implemented",
      "note": "Real mr4660140 extraction accepted after schema tightening."
    }
  ]
}
