{
  "schema_version": "quiver.improvement.v1",
  "id": "QI-0005",
  "title": "Use dependency-style relation names",
  "category": "schema",
  "status": "implemented",
  "severity": "high",
  "confidence": "high",
  "problem": "The first real extraction used a proves relation in a direction that made counterexample/theorem semantics ambiguous.",
  "proposed_change": "Rename proof/computation relations to proved_by and computed_by, and add refuted_by with prompt examples.",
  "acceptance_criteria": "Retraction examples represent theorem <- refuted_by <- counterexample under dependent/prerequisite semantics.",
  "observations": [],
  "created_at": "2026-06-22T12:19:47.268264Z",
  "updated_at": "2026-06-22T12:19:47.346668Z",
  "history": [
    {
      "at": "2026-06-22T12:19:47.346702Z",
      "from": "proposed",
      "to": "implemented",
      "note": "Second mr4660140 extraction produced refuted_by in the intended direction."
    }
  ]
}
