{
  "schema_version": "quiver.improvement.v1",
  "id": "QI-0002",
  "title": "Do not require model-authored graph levels",
  "category": "schema",
  "status": "implemented",
  "severity": "medium",
  "confidence": "high",
  "problem": "Prompting Codex to label concepts as L0/L1/L2/L3 adds schema weight and mixes extraction with derived graph analysis.",
  "proposed_change": "Keep extraction nodes role-based only; compute dependency depth later from the merged graph when a visualization needs it.",
  "acceptance_criteria": "GraphDelta schema, prompt, validator, merge output, and viewer do not require graph_layer or L0/L1/L2/L3 values.",
  "observations": [],
  "created_at": "2026-06-22T12:01:07.099594Z",
  "updated_at": "2026-06-22T12:01:07.184585Z",
  "history": [
    {
      "at": "2026-06-22T12:01:07.184622Z",
      "from": "proposed",
      "to": "implemented",
      "note": "Removed graph_layer from MVP graph contracts."
    }
  ]
}
